Reference	ID	Tags	SupportReference	Quote	Occurrence	Note
2:13	zc5n		rc://*/ta/man/translate/writing-politeness	וְ⁠אָנֹכִי֙ לֹ֣א אֶֽהְיֶ֔ה כְּ⁠אַחַ֖ת שִׁפְחֹתֶֽי⁠ךָ	1	Ruth is expressing surprise and gratitude that Boaz is treating her as if she belongs among his workers, which she does not. She is being very humble, admitting that she does not even have the status of a servant before him. Use a form for addressing someone respectfully in your language. Alternate translation: “But I do not even have the status of being one of your servant girls”
2:14	yht2			לְ⁠עֵ֣ת הָ⁠אֹ֗כֶל	1	Alternate translation: “at the time of the midday meal”
2:14	jbri		rc://*/ta/man/translate/figs-imperative	גֹּ֤שִֽׁי הֲלֹם֙ וְ⁠אָכַ֣לְתְּ מִן־הַ⁠לֶּ֔חֶם וְ⁠טָבַ֥לְתְּ פִּתֵּ֖⁠ךְ בַּ⁠חֹ֑מֶץ	1	The verbs in this sentence are imperatives that communicate a gracious invitation rather than a command. Use a form in your language that communicates a gracious invitation. It may be helpful to add an expression such as “please” to make this clear. Alternate translation: “Please come, and help yourself to the bread and dip it in the vinegar”
2:14	duch		rc://*/ta/man/translate/figs-infostructure	וְ⁠אָכַ֣לְתְּ מִן־הַ⁠לֶּ֔חֶם וְ⁠טָבַ֥לְתְּ פִּתֵּ֖⁠ךְ בַּ⁠חֹ֑מֶץ	1	It would be necessary to dip the bread and then eat it, so it might be more natural in your language to put the information about dipping the bread first. Alternate translation: “and dip some of this bread in the vinegar and eat it”
2:14	p256		translate-unknown	וְ⁠טָבַ֥לְתְּ פִּתֵּ֖⁠ךְ בַּ⁠חֹ֑מֶץ	1	This was a simple meal eaten in the field. People would sit on the ground around a cloth that had a bowl of wine vinegar on it and pieces of broken bread. They would take a piece of bread and dip it in the wine vinegar to add flavor before they ate it. The Israelites made vinegar from grape juice that was fermented beyond the point of being wine. At the vinegar stage, the juice becomes very sour and acidic. Alternate translation: “and please dip your piece of bread in the wine vinegar first”
2:15	v6wr		rc://*/ta/man/translate/figs-explicit	וַ⁠יְצַו֩ בֹּ֨עַז אֶת־נְעָרָ֜י⁠ו	1	When Boaz spoke to his workers, it is likely that Ruth was far enough away that she did not hear Boaz’s instructions. If it would be helpful in your language, you could include this information. Alternate translation: “Then Boaz privately instructed his young men”
2:15	a5z9		translate-unknown	גַּ֣ם בֵּ֧ין הָֽ⁠עֳמָרִ֛ים	1	Here, the word **even** lets the workers know that they are to do above and beyond what they normally do. People who were gleaning were normally forbidden from working close to the harvested grain because then it would be easy for them to steal from the grain that was already harvested. But Boaz instructs his workers to let Ruth glean close to the bundles of harvested grain. Alternate translation: “among the bundles as well”
2:15	usb1		rc://*/ta/man/translate/figs-explicit	וְ⁠לֹ֥א תַכְלִימֽוּ⁠הָ	1	Boaz is referring to shaming Ruth by scolding her verbally. You could include this information if that would be helpful to your readers. Alternate translation: “and do not shame her by saying that she should stop”
2:16	u6hv		translate-unknown	וְ⁠גַ֛ם	1	 Here Boaz goes another step beyond what is normal and tells his workers to also drop on the ground some of the grain that they had harvested for Ruth to pick up. Alternate translation: “Not only that, but also”
2:16	nn9l			וְ⁠לֹ֥א תִגְעֲרוּ־בָֽ⁠הּ	1	Alternate translation: “and do not cause her shame” or “and do not speak harshly to her”
2:17	h3ap		translate-unknown	וַ⁠תַּחְבֹּט֙	1	Ruth would have beaten the barley stalks with a big stick until the kernels of edible grain came off. She would then keep only the kernels of grain. Alternate translation: “She beat the edible kernels of grain off of the stalks from”
2:17	mq6b		rc://*/ta/man/translate/translate-bvolume	כְּ⁠אֵיפָ֥ה	1	An **ephah** is a unit of measurement equal to about 22 liters. Use the normal measurement for grain in your language. Alternate translation: “about 22 liters of” or “over half a bushel of”
2:18	etn8		rc://*/ta/man/translate/figs-explicit	וַ⁠תִּשָּׂא֙ וַ⁠תָּב֣וֹא הָ⁠עִ֔יר	1	It is implied that Ruth carried the grain home.
2:19	bg28		rc://*/ta/man/translate/figs-parallelism	אֵיפֹ֨ה לִקַּ֤טְתְּ הַ⁠יּוֹם֙ וְ⁠אָ֣נָה עָשִׂ֔ית	1	Naomi asked the same thing in two different ways to show that she was very excited and interested in knowing what had happened to Ruth that day. If it is not natural in your language to show excitement and interest by repeating a question, then use a more natural form. Alternate translation: “Wow, whose field did you work in today”
2:19	soyh		rc://*/ta/man/translate/translate-blessing	יְהִ֥י מַכִּירֵ֖⁠ךְ בָּר֑וּךְ	1	Naomi is asking God to bless Boaz. You could express this as either a blessing or a prayer. Use whichever way is more natural in your language. Alternate translation: “God, bless the one who noticed Ruth today”
2:19	o7da		rc://*/ta/man/translate/figs-activepassive	יְהִ֥י מַכִּירֵ֖⁠ךְ בָּר֑וּךְ	1	If your language does not use this passive form, you could express the idea in active form or in another way that is natural in your language. Alternate translation: “May God bless the one who noticed you”
2:19	ab07		rc://*/ta/man/translate/figs-metonymy	מַכִּירֵ֖⁠ךְ	1	The writer is using the term **noticed** to mean that the person not only saw Ruth but also did something kind for her. If it would be helpful in your language, you could state the meaning plainly. Alternate translation: “the one who helped you”
2:19	lgh8		rc://*/ta/man/translate/figs-parallelism	וַ⁠תַּגֵּ֣ד לַ⁠חֲמוֹתָ֗⁠הּ אֵ֤ת אֲשֶׁר־עָשְׂתָה֙ עִמּ֔⁠וֹ וַ⁠תֹּ֗אמֶר שֵׁ֤ם הָ⁠אִישׁ֙ אֲשֶׁ֨ר עָשִׂ֧יתִי עִמּ֛⁠וֹ הַ⁠יּ֖וֹם בֹּֽעַז	1	These two sentences mean basically the same thing. The second sentence repeats the meaning of the first, while using different words in order to emphasize the importance of this information for the story. If it would be helpful to your readers, you could combine the sentences or connect them in a way that shows that the second sentence is repeating the first one, not saying something additional. Alternate translation: “Then she told her mother-in-law that the name of the man with whom she had worked that day was Boaz” or “Then she told her mother-in-law with whom she had worked. She said, “The name of the man with whom I worked today is Boaz.”
2:20	p8km		rc://*/ta/man/translate/translate-blessing	בָּר֥וּךְ הוּא֙ לַ⁠יהוָ֔ה	1	Naomi is asking God to bless Boaz. You could express this as either a blessing or a prayer, in whichever way is more natural in your language. Alternate translation: “I pray that he will be blessed by Yahweh”
2:20	gj3w		rc://*/ta/man/translate/figs-activepassive	בָּר֥וּךְ הוּא֙ לַ⁠יהוָ֔ה	1	If your language does not use this passive form, you could express the idea in active form or in another way that is natural in your language. If you use an active form, you may need to start a new sentence afterward, as in the UST.
2:20	ab20		rc://*/ta/man/translate/figs-doublenegatives	אֲשֶׁר֙ לֹא־עָזַ֣ב	1	If it would be clearer in your language, you could use a positive expression to translate this double negative that consists of the negative particle **not** and the negative word **forsaken**. Alternate translation: “who has continued to be loyal to”
2:20	ur7z		rc://*/ta/man/translate/figs-pronouns	אֲשֶׁר֙ לֹא־עָזַ֣ב	1	Here, **who** could refer to: (1) **Yahweh**, who has continued to be faithful to the living and the dead by acting through Boaz. (2) Boaz, who is showing faithfulness to Naomi's family by helping Ruth.
2:20	ljz3		rc://*/ta/man/translate/figs-nominaladj	אֶת־הַ⁠חַיִּ֖ים	1	Naomi is using the adjective **living** as a noun to mean those who continue to live, referring to herself and Ruth. Your language may use adjectives in the same way. If not, you could translate this word with an equivalent phrase. Alternate translation: “with the people who are still living”
2:20	wjr4		rc://*/ta/man/translate/figs-nominaladj	וְ⁠אֶת־הַ⁠מֵּתִ֑ים	1	Naomi is using the adjective **dead** as a noun to mean those who have died. She is referring to her husband and sons. Your language may use adjectives in the same way. If not, you could translate this word with an equivalent phrase. Alternate translation: “and with the people who have already died”
2:20	cyy2		rc://*/ta/man/translate/figs-parallelism	קָר֥וֹב לָ֨⁠נוּ֙ הָ⁠אִ֔ישׁ מִֽ⁠גֹּאֲלֵ֖⁠נוּ הֽוּא	1	These two sentences mean basically the same thing. The second sentence repeats the meaning of the first using different words in order to emphasize the importance of this information for the story. If it would be helpful to your readers, you could combine the sentences or connect them in a way that shows that the second sentence is repeating the first one, not saying something additional. Alternate translation: “That man is closely related to us, which means that he is one of our kinsman-redeemers” or “That man is closely related to us. Yes, he is one of our kinsman-redeemers”
2:20	zu5f		translate-unknown	מִֽ⁠גֹּאֲלֵ֖⁠נוּ	1	A kinsman-redeemer was a close male relative who had the responsibility to take care of any widows in the family. If one of his brothers died childless, he had the responsibility to marry the widow if she was still of child-bearing age, to raise a child for his brother. He would also reacquire the land his relatives had lost due to poverty and redeem family members who had sold themselves into slavery. See the Introduction for more information.
2:21	k2lz		rc://*/ta/man/translate/figs-explicit	גַּ֣ם ׀ כִּי־אָמַ֣ר אֵלַ֗⁠י	1	The implication is that what follows is beyond what anyone would have expected a landowner to say to Ruth. You could include this information if that would be helpful to your readers. Alternate translation: “He even said to me”
2:21	ofkk		rc://*/ta/man/translate/figs-quotesinquotes	אָמַ֣ר אֵלַ֗⁠י עִם־הַ⁠נְּעָרִ֤ים אֲשֶׁר־לִ⁠י֙ תִּדְבָּקִ֔י⁠ן עַ֣ד אִם־כִּלּ֔וּ אֵ֥ת כָּל־הַ⁠קָּצִ֖יר אֲשֶׁר־לִֽ⁠י	1	natural laIf your language would not use a direct quotation inside of a direct quotation, you could translate the second direct quotation as an indirect quotation. Alternate translation: “He said that I should keep close by his servants until they have finished all of his harvest”
2:21	g585		rc://*/ta/man/translate/figs-explicit	עִם־הַ⁠נְּעָרִ֤ים אֲשֶׁר־לִ⁠י֙ תִּדְבָּקִ֔י⁠ן	1	The implication is that Boaz wants to protect and provide for Ruth. Boaz was expressing confidence that his workers would not harm Ruth. You could include this information if that would be helpful to your readers. Alternate translation: “I want you to glean safely, near my field workers,”
2:22	f2tw			תֵֽצְאִי֙ עִם	1	Alternate translation: “you work with” or “you glean alongside”
2:22	bcc4		rc://*/ta/man/translate/figs-pronouns	וְ⁠לֹ֥א יִפְגְּעוּ־בָ֖⁠ךְ	1	Here, **they** refers to anyone in general. Alternate translation: “so that someone does not harm you” or “so that no one would hurt you”
2:23	e2vq		rc://*/ta/man/translate/grammar-connect-logic-result	וַ⁠תִּדְבַּ֞ק	1	Here, **So** indicates that what follows is a result of what came before. Use a connector in your language that makes it clear that what follows is a result of what came before. Alternate translation: “Because of these instructions, she stayed close” or “Therefore, Ruth continued to work”
2:23	svlg		rc://*/ta/man/translate/figs-activepassive	עַד־כְּל֥וֹת קְצִֽיר־הַ⁠שְּׂעֹרִ֖ים וּ⁠קְצִ֣יר הַֽ⁠חִטִּ֑ים	1	If your language does not use this passive form, you could express the idea in active form or in another way that is natural in your language. Alternate translation: “until Boaz's workers had harvested all of the barley and the wheat”
3:intro	t4y5				0	# Ruth 3 General Notes\n\n## Religious and Cultural Concepts in This Chapter\n\n### Boaz’s integrity\n\nBoaz showed great integrity in this chapter by not having sexual relations with Ruth until they were married. He was also concerned with preserving Ruth’s good reputation. Displaying Boaz’s good character is an important point in this chapter.\n\n## Translation Issues in This Chapter\n\n### **So that it may be well with you**\n\nNaomi wanted Ruth to have a secure home with a good husband who would care for her. She could see that Boaz would be the best husband for her. She also thought that Boaz, as a kinsman-redeemer, had an obligation to marry her. This could be true because, even though Ruth was a Gentile by birth, she had become part of Naomi’s family and part of the nation of Israel. (See: [[rc://*/ta/man/translate/figs-explicit]])
3:1	jdr3		rc://*/ta/man/translate/writing-newevent	 וַ⁠תֹּ֥אמֶר לָ֖⁠הּ נָעֳמִ֣י חֲמוֹתָ֑⁠הּ	1	The writer is using the word translated **Then** to introduce the next part of the story, in which Ruth asks Boaz to perform the role of kinsman-redeemer for her and Naomi. Use a word, phrase, or other method in your language that is natural for introducing a new event. Alternate translation: “After some time, Naomi, Ruth's mother-in-law, said to her”
3:1	r7ar		rc://*/ta/man/translate/translate-kinship	חֲמוֹתָ֑⁠הּ	1	Naomi is the mother of Ruth’s dead husband, and thus, is Ruth's **mother-in-law**. Alternate translation: “the mother of Ruth's dead husband”
3:1	ry8p		rc://*/ta/man/translate/translate-kinship	נָעֳמִ֣י חֲמוֹתָ֑⁠הּ	1	**Naomi** is Ruth's **mother-in-law**. If it is not natural to include both the name and the relationship term in your language, choose the one that refers to Naomi most naturally. Alternate translation: “Ruth's mother-in-law”
3:1	y1ey		rc://*/ta/man/translate/figs-pronouns	חֲמוֹתָ֑⁠הּ	1	In this verse, **her** refers to Ruth. Alternate translation: “Ruth's mother-in-law”
3:1	f1uc		rc://*/ta/man/translate/translate-kinship	בִּתִּ֞⁠י	1	Ruth became Naomi's daughter-in-law by marrying Naomi's son. But here Naomi calls her **My daughter** to show that she loves her as much as she would love her own daughter. Use a form of address in your language that shows that Naomi loves Ruth as she would love a daughter. Alternate translation: “My dear one”
3:1	nxr8		rc://*/ta/man/translate/figs-rquestion	הֲ⁠לֹ֧א אֲבַקֶּשׁ־לָ֛⁠ךְ מָנ֖וֹחַ אֲשֶׁ֥ר יִֽיטַב־לָֽ⁠ךְ	1	Naomi is using the question form to cause Ruth to think of her future. Here, Naomi uses this question to tell Ruth what she plans to do. If you would not use the question form for this purpose in your language, you could translate this as a statement or an exclamation. Alternate translation: “I must look for a place for you to rest, in a place that will be good for you.” or “I must find a husband to care for you, who will be good to you.”
3:1	uw2p		rc://*/ta/man/translate/figs-metaphor	מָנ֖וֹחַ	1	Here, Naomi is speaking of a permanent home as **a resting place**. This does not mean a place to rest temporarily from being tired. It means a place of permanent comfort and security in a good home with a husband. If it would be helpful in your language, you could state the meaning plainly. Alternate translation: “a permanent home” or “a husband”
3:2	jdr4		rc://*/ta/man/translate/grammar-connect-logic-result	וְ⁠עַתָּ֗ה	1	Naomi’s rhetorical question in [3:1](../03/01.md) gave the reason for the plan that she is about to tell to Ruth in verses [3:2–4](../03/02.md). Use a connector in your language that marks what follows as a planned result of what was said before. Alternate translation: “Because of that, I have been thinking.”
3:2	b4h8		rc://*/ta/man/translate/figs-rquestion	הֲ⁠לֹ֥א בֹ֨עַז֙ מֹֽדַעְתָּ֔⁠נוּ אֲשֶׁ֥ר הָיִ֖ית אֶת־נַעֲרוֹתָ֑י⁠ו	1	Naomi uses the question form here to remind Ruth of something she had already told her (See [2:20](../02/20.md)). If you would not use the question form for this purpose in your language, you could translate this as a statement. Alternate translation: “as you know, Boaz, the one with whose young female workers you have been working, is our relative.”
3:2	j31t		rc://*/ta/man/translate/figs-explicit	אֲשֶׁ֥ר הָיִ֖ית אֶת־נַעֲרוֹתָ֑י⁠ו	1	The implication is that Boaz owned the fields where Ruth worked together with these young women, not that Boaz owned the young women. You could clarify this information if that would be helpful to your readers. Alternate translation: “the one who owns the fields where you have been working with the other female workers”
3:2	nd8v		rc://*/ta/man/translate/figs-metaphor	הִנֵּה	1	Naomi is using the term **Behold** to focus Ruth's attention on what she is about to say. Your language may have a comparable expression that you could use in your translation. Alternate translation: “Look”
3:3	ru6z			וָ⁠סַ֗כְתְּ	1	Alternate translation: “rub sweet-smelling oil on yourself”
3:3	e92h		rc://*/ta/man/translate/translate-unknown	וְיָרַ֣דְתְּ הַ⁠גֹּ֑רֶן	1	A **threshing floor** is an open, flat area where workers could thresh and winnow grain. It would be outside of the city, which was high on a hill, and thus, one would go “down” to it. If your readers would not be familiar with this type of agricultural site, you could use the name of something similar in your area or you could use a more general term. Alternate translation: “and leave the city to go to the flat place where he will thresh and winnow his grain”
3:3	m6zw		figs-extrainfo	לֶ⁠אֱכֹ֥ל וְ⁠לִ⁠שְׁתּֽוֹת	1	If it would be unnatural to express these details of a meal in your language, you could use a more natural phrase. Alternate translation: “his supper”
3:4	jdr5		rc://*/ta/man/translate/figs-imperative	וִ⁠יהִ֣י	1	The phrase **And let it be** introduces the next series of specific instructions that Naomi is about to give to Ruth. Use a form in your language that introduces a series of instructions, or omit the phrase if your language does not do this. Use a colon to replace the comma. Alternate translation: “Do this:”
3:4	ln1m		rc://*/ta/man/translate/translate-symaction	וְ⁠גִלִּ֥ית מַרְגְּלֹתָ֖י⁠ו	1	To **uncover his feet** means to remove the cloak or blanket covering his feet, and probably also his legs. This action by a woman was probably a symbolic action that was interpreted as a proposal of marriage. If it would be helpful to your readers, you could include this information in a footnote.
3:4	zi01		rc://*/ta/man/translate/figs-euphemism	מַרְגְּלֹתָ֖י⁠ו	1	The word translated **feet** could be used as a euphemism for a man's private parts, but here it refers to the man's feet or legs. If your language has a word that works in this way, you can use it here. Otherwise, use a word for “feet” or “legs” and consider putting this information in a footnote.
3:4	w1u5			וְ⁠הוּא֙ יַגִּ֣יד לָ֔⁠ךְ אֵ֖ת אֲשֶׁ֥ר תַּעַשִֽׂי⁠ן	1	The specific custom of that time is unclear, but Naomi appears to believe that Boaz will understand Ruth’s action as a proposal of marriage. Boaz will then either accept or reject her offer. If it would be helpful, you could include this information in a footnote.
3:4	nn4g		figs-rpronouns	וְ⁠הוּא֙ יַגִּ֣יד	1	Here, the word **himself** emphasizes that Boaz will decide what happens next, not Naomi or Ruth. Use a way that is natural in your language to indicate this significance. Alternate translation: “Then it will be Boaz who will tell”
3:6	ab22		rc://*/ta/man/translate/figs-infostructure	וַ⁠תַּ֕עַשׂ כְּ⁠כֹ֥ל אֲשֶׁר־צִוַּ֖תָּ⁠ה חֲמוֹתָֽ⁠הּ׃	1	This statement summarizes the actions that Ruth will do in [3:7](../03/7.md). If people misunderstand from this that Ruth did these actions in [3:6](../03/6.md) and then did them again in [3:7](../03/7.md), then you could translate this sentence as **and she obeyed her mother-in-law**. Or if it would make the order of events more clear, you could move this sentence to the end of [3:7](../03/7.md), then combine the verse numbers as a verse bridge (6–7).
3:7	fz7e		rc://*/ta/man/translate/figs-metonymy	וַ⁠יִּיטַ֣ב לִבּ֔⁠וֹ	1	Here **heart** stands for “emotions” or “disposition.” Boaz’s emotions or feelings were good. This does not imply that Boaz was drunk. Alternate translation: “and he felt good” or “and he was in a good mood”
3:7	y6gk			וַ⁠תָּבֹ֣א בַ⁠לָּ֔ט	1	Alternate translation: “Then she sneaked in” or “Then she came in so quietly that no one could hear her”
3:7	eq2u		rc://*/ta/man/translate/figs-euphemism	וַ⁠תְּגַ֥ל מַרְגְּלֹתָ֖י⁠ו	1	See how you translated **feet** in [3:4](../03/4.md). Alternate translation: “and removed the covering from his legs”
3:8	pz92		rc://*/ta/man/translate/writing-background	וַ⁠יְהִי֙ בַּ⁠חֲצִ֣י הַ⁠לַּ֔יְלָה	1	This clause gives information about when the next event in the story happened. Use a natural way in your language to give background information. Alternate translation: “Hours later, in the middle of the night,”
3:8	xun6		rc://*/ta/man/translate/figs-activepassive	וַ⁠יֶּחֱרַ֥ד הָ⁠אִ֖ישׁ	1	If your language does not use this passive form, you could express the idea in active form or in another way that is natural in your language. It is not clear what startled Boaz. Perhaps he suddenly felt the cold air on his feet or legs. Alternate translation: “the man startled”
3:8	ab23		rc://*/ta/man/translate/figs-exclamations	וְ⁠הִנֵּ֣ה	1	Here the word **behold** shows that what follows was very surprising to Boaz. Use your language’s way of expressing surprise. Alternate translation: “And much to his surprise”
3:9	wj9e		rc://*/ta/man/translate/writing-politeness	אֲמָתֶ֔⁠ךָ & אֲמָ֣תְ⁠ךָ֔	1	Ruth was not one of Boaz’s servants, but she referred to herself as Boaz’s servant as a polite way to express respect to Boaz. Use your language’s way of expressing humility and respect. Alternate translation: “your humble handmaid” … “your humble handmaid”
3:9	xp1b		rc://*/ta/man/translate/figs-idiom	וּ⁠פָרַשְׂתָּ֤ כְנָפֶ֨⁠ךָ֙ עַל־אֲמָ֣תְ⁠ךָ֔	1	This was a cultural idiom for marriage. Alternate translation: “Please marry me”
3:9	l5g4		rc://*/ta/man/translate/translate-kinship	גֹאֵ֖ל	1	See how you translated this term in [2:20](../02/20/zu5f).
3:10	hvwq		rc://*/ta/man/translate/translate-blessing	בְּרוּכָ֨ה אַ֤תְּ לַֽ⁠יהוָה֙	1	Use a natural form for a blessing in your language. Alternate translation: “A blessing from Yahweh on you”
3:10	qxnp		rc://*/ta/man/translate/figs-idiom	בִּתִּ֔⁠י	1	See how you translated **my daughter** in [2:8](../02/8.md). Boaz uses this phrase again here to communicate kindness and respect from a man to a younger woman. Use an appropriate phrase in your language. Alternate translation: “little one”
3:10	bjw9		rc://*/ta/man/translate/figs-explicit	הֵיטַ֛בְתְּ חַסְדֵּ֥⁠ךְ הָ⁠אַחֲר֖וֹן מִן־הָ⁠רִאשׁ֑וֹן	1	By marrying Naomi’s relative who is a kinsman-redeemer, Ruth would also provide for Naomi, honor Naomi’s son, and continue Naomi’s family line. Boaz considers this to be Ruth's greatest demonstration of faithfulness to Naomi. If it would be helpful to your readers, you could put this information in a footnote. Alternate translation: “You are demonstrating even more loving kindness now than before”
3:10	cbd3		rc://*/ta/man/translate/figs-explicit	הָ⁠רִאשׁ֑וֹן	1	Boaz is using the phrase **at the beginning** to refer to the way that Ruth had earlier provided for her mother-in-law by staying with her and gleaning grain for food for both of them. If it would be helpful to your readers, you could state the meaning plainly. Alternate translation: “when you first came here with Naomi”
3:10	n84d		rc://*/ta/man/translate/figs-idiom	לְ⁠בִלְתִּי־לֶ֗כֶת אַחֲרֵי֙	1	Boaz is praising Ruth for **not going after* the young men, by which he means that Ruth could have ignored Naomi’s need and looked for a young and handsome husband for herself outside of Elimelek's relatives, but she did not. Alternate translation: “because you have not looked for marriage among”
