Reference	ID	Tags	SupportReference	Quote	Occurrence	Note
1:17	ab05		rc://*/ta/man/translate/figs-idiom	יַפְרִ֖יד בֵּינִ֥⁠י וּ⁠בֵינֵֽ⁠ךְ	1	This phrase is an idiom that means “separates you and me.” If this phrase does not have that meaning in your language, you could use an idiom from your language that does have this meaning or state the meaning plainly. Alternate translation: “separates the two of us” or “comes between us”
1:18	rsq2		rc://*/ta/man/translate/grammar-connect-logic-result	וַ⁠תֶּחְדַּ֖ל לְ⁠דַבֵּ֥ר אֵלֶֽי⁠הָ	1	This phrase expresses the result of the previous phrase. You may want to indicate this by using a connector that introduces a result. Alternate translation: “so she refrained from speaking to her further”
1:18	xncr		rc://*/ta/man/translate/figs-pronouns	וַ⁠תֶּחְדַּ֖ל לְ⁠דַבֵּ֥ר אֵלֶֽי⁠הָ	1	In this phrase, **she** refers to Naomi, and **her** refers to Ruth. If it would be helpful in your language, you could use their names here. Also, this does not mean that Naomi was angry with Ruth or that she no longer spoke to her at all. It only means that she stopped trying to persuade Ruth to leave her. Alternate translation: “so Naomi stopped trying to persuade Ruth”
1:19	j9wa		rc://*/ta/man/translate/writing-newevent	וַ⁠יְהִ֗י	1	**And it happened** introduces a new event in the story. Use a word, phrase, or other method in your language that is natural for introducing a new event. Alternate translation: “And it came about”
1:19	jdr1		rc://*/ta/man/translate/grammar-connect-time-background	כְּ⁠בֹאָ֨⁠נָה֙ בֵּ֣ית לֶ֔חֶם	1	This phrase provides background information about their arrival to help readers understand what happens next in the story. In your translation, present this information in a way that makes it clear that this is background information. Alternate translation: “while Naomi and Ruth were still walking into Bethlehem”
1:19	y3us		rc://*/ta/man/translate/figs-metonymy	כָּל־הָ⁠עִיר֙	1	Here, **town** represents the people who live there. If it would be helpful in your language, you could use an equivalent expression from your language or state the meaning plainly. Alternate translation: “everyone who lived there”
1:19	abc3		rc://*/ta/man/translate/figs-hyperbole	כָּל־הָ⁠עִיר֙	1	The word **entire** here is a generalization for emphasis. If it would be helpful in your language, you could use a different way to express the emphasis. Many of the residents of the town were excited, but not all of the residents may have been excited by this news. Alternate translation: “most of the residents”
1:19	xnb3		rc://*/ta/man/translate/figs-rquestion	הֲ⁠זֹ֥את נָעֳמִֽי	1	The writer is using a rhetorical question to emphasize the reaction of the people to Naomi's condition upon her return. If you would not use the question form for this purpose in your language, you could translate this as a statement or an exclamation. Because it had been many years since Naomi lived in Bethlehem and now she no longer has her husband and two sons, it is likely that the women were expressing shock that this woman was actually Naomi. Alternate translation: “This must be Naomi, but I do not see her family!”
1:20	stw5		rc://*/ta/man/translate/translate-names	אַל־תִּקְרֶ֥אנָה לִ֖⁠י נָעֳמִ֑י	1	The name **Naomi** means “delight” or “pleasantness.” If it would be helpful in your language, you could include this information in the text or in a footnote. Alternate translation: “It is no longer appropriate to call me Naomi, the Pleasant One.”
1:20	swe9		rc://*/ta/man/translate/translate-names	מָרָ֔א	1	The name **Mara** means “bitter.” If it would be helpful in your language, you could include this information in the text or in a footnote. Alternate translation: “Mara, the Bitter One”
1:21	n9zc		rc://*/ta/man/translate/figs-metaphor	אֲנִי֙ מְלֵאָ֣ה הָלַ֔כְתִּי וְ⁠רֵיקָ֖ם הֱשִׁיבַ֣⁠נִי יְהוָ֑ה	1	Here, Naomi is speaking of herself as a container that can be **full** or **empty**. If it would be helpful in your language, you could state the meaning plainly. Alternate translation: “As for me, I went out with a complete family, but Yahweh has brought me back with no one”
1:21	be0f		rc://*/ta/man/translate/figs-rquestion	לָ֣⁠מָּה תִקְרֶ֤אנָה לִ⁠י֙ נָעֳמִ֔י	1	Naomi is using the question form to emphasize that there is no reason to call her Naomi. If you would not use the question form for this purpose in your language, you could translate this as a statement or an exclamation. Alternate translation: “There is no reason to call me Naomi!”
1:21	dvyb		rc://*/ta/man/translate/figs-parallelism	 וַֽ⁠יהוָה֙ עָ֣נָה בִ֔⁠י וְ⁠שַׁדַּ֖י הֵ֥רַֽע לִֽ⁠י	1	These two statements say the same thing using different words to emphasize the idea that God has made Naomi's life very hard. Both **Yahweh** and **the Almighty** refer to God. If it would be helpful to your readers, you could combine the statements to show that the second statement is not saying a new thing. Alternate translation: “But as for Yahweh, the Almighty God, he has opposed me and treated me badly.”
1:21	jqx5		rc://*/ta/man/translate/figs-metaphor	עָ֣נָה בִ֔⁠י	1	Here Naomi is speaking of **Yahweh** as if he were a witness who caused her to be punished for a crime. If it would be helpful in your language, you could state the meaning plainly. Alternate translation: “he has brought punishment on me”
1:21	t1p8			הֵ֥רַֽע לִֽ⁠י	1	Alternate translation: “has brought calamity on me” or “has brought tragedy to me”
1:22	cx7g		rc://*/ta/man/translate/writing-endofstory	וַ⁠תָּ֣שָׁב נָעֳמִ֗י וְ⁠ר֨וּת הַ⁠מּוֹאֲבִיָּ֤ה כַלָּתָ⁠הּ֙ עִמָּ֔⁠הּ הַ⁠שָּׁ֖בָה מִ⁠שְּׂדֵ֣י מוֹאָ֑ב	1	This sentence provides a brief summary and conclusion of the story so far. It does not provide new information or new events in the story. Your language may have its own way of showing that this is the end of a section of a story. Follow that way here.
1:22	jdr2		rc://*/ta/man/translate/writing-background	וְ⁠הֵ֗מָּה בָּ֚אוּ בֵּ֣ית לֶ֔חֶם בִּ⁠תְחִלַּ֖ת קְצִ֥יר שְׂעֹרִֽים	1	This sentence provides background information to help readers understand what happens next in the story. In your translation, present this information in a way that makes it clear that this is background information.
1:22	bgy3		rc://*/ta/man/translate/figs-abstractnouns	בִּ⁠תְחִלַּ֖ת קְצִ֥יר שְׂעֹרִֽים	1	The phrase **the harvest of barley** can be translated with a verbal phrase if that would be helpful in your language. Alternate translation: “when the farmers were just beginning to harvest barley” or “when the farmers started harvesting the barley”
2:intro	ld2v				0	# Ruth 2 General Notes\n\n## Translation Issues in This Chapter\n\n### “a man of great worth” (2:1)\n\nThis phrase describes Boaz as having good attributes, but in a very general way. The phrase could describe a man who is physically strong and able, wealthy, or of good, godly character, or all of those things. From the context of the story, we can see that Boaz has land, servants who respect him, and he lives in a way that honors God, so it seems that this phrase is describing his wealth and character. Think about how you would describe someone like this in your language.\n\n### “Do not go to glean in another field” (2:8)\n\nBoaz said this because he could not guarantee Ruth’s safety in another person’s field. It seems that not everyone was as gracious and obedient to the law of Moses as was Boaz. (See: [[rc://*/tw/dict/bible/kt/grace]] and [[rc://*/tw/dict/bible/kt/lawofmoses]])\n\n### “kinsman-redeemer” (2:20)\n\nA “kinsmen-redeemer” was a male relative who was responsible to provide for any close member of the same clan who was in need, fulfill obligations of levirate marriage, and buy back land into the family that had been sold to someone outside of the family. See the book introduction for more information.
2:1	ab10		rc://*/ta/man/translate/writing-background	וּֽ⁠לְ⁠נָעֳמִ֞י מוֹדַ֣ע לְ⁠אִישָׁ֗⁠הּ	1	Verse 1 gives background information about Boaz so that the reader will understand who he is. In your translation, present this information in a way that makes it clear that this is background information.
2:1	t2sn		rc://*/ta/man/translate/writing-participants	וּֽ⁠לְ⁠נָעֳמִ֞י מוֹדַ֣ע לְ⁠אִישָׁ֗⁠הּ	1	This phrase begins the introduction of **Boaz** as a new participant in the story. If your language has its own way of introducing new participants, you could use it here in your translation.
2:1	b4q7		rc://*/ta/man/translate/figs-idiom	אִ֚ישׁ גִּבּ֣וֹר חַ֔יִל	1	The expression **a man of great worth** describes Boaz as a person who was prosperous and well known in his community, with a good reputation. If it would be helpful in your language, you could use an equivalent idiom from your language or state this plainly. See the chapter introduction for more information. Alternate translation: “a prominent, wealthy man”
2:1	ab09		rc://*/ta/man/translate/translate-kinship	מִ⁠מִּשְׁפַּ֖חַת אֱלִימֶ֑לֶךְ	1	The use of the term **clan** here means that Boaz was related to Elimelek but did not have the same parents as Elimelek. The text is not saying that the clan was named after Elimelek or that Elimelek was the patriarch or leader of the clan, but only that Elimelek and Boaz belonged to the same clan.
2:2	am6a		rc://*/ta/man/translate/writing-participants	ר֨וּת הַ⁠מּוֹאֲבִיָּ֜ה	1	Here the writer reintroduces Ruth after giving background information about someone else. If your language has its own way of reintroducing old participants when it resumes a story, you could use it here in your translation. Alternate translation: “the same Moabite woman, Ruth”
2:2	c7rk			הַ⁠מּוֹאֲבִיָּ֜ה	1	Alternate translation: “from the country of Moab”
2:2	j59b		rc://*/ta/man/translate/figs-idiom	אֲשֶׁ֥ר אֶמְצָא־חֵ֖ן בְּ⁠עֵינָ֑י⁠ו	1	The idiom **in whose eyes I find favor** means “whoever will approve of me.” Ruth speaks of gaining someone’s favor as gaining permission, kindness, or approval. If it would be helpful in your language, you could state the meaning plainly. Alternate translation: “anyone who gives me permission” or “whoever will be kind to me”
2:2	ed93		rc://*/ta/man/translate/translate-kinship	בִתִּֽ⁠י	1	Ruth was caring for Naomi as if she were her own mother, and Naomi addressed Ruth affectionately as her daughter. If it would be helpful in your language, use the term in your language that would indicate this kind of close relationship between two women.
2:3	ht73		rc://*/ta/man/translate/figs-explicit	וַ⁠יִּ֣קֶר מִקְרֶ֔⁠הָ	1	The phrase, **her chance chanced upon** indicates that Ruth did not know whose field she was in. You could include this information if that would be helpful to your readers. Alternate translation: “Being unaware of who owned the field, Ruth came to”
2:3	ab11		rc://*/ta/man/translate/translate-kinship	מִ⁠מִּשְׁפַּ֥חַת אֱלִימֶֽלֶךְ	1	The use of the term **clan** here means that Boaz was related to Elimelek but did not have the same parents as Elimelek. The text is not saying that the clan was named after Elimelek or that Elimelek was the patriarch or leader of the clan.
2:4	vys2		rc://*/ta/man/translate/figs-metaphor	וְ⁠הִנֵּה	1	The writer is using the term **behold** to alert us to the important event of Boaz arriving at the field and seeing Ruth for the first time. Your language may have a comparable way of calling attention to this event that you can use in your translation. Alternate translation: “Then look”
2:4	q1lv		rc://*/ta/man/translate/translate-tense	בָּ֚א מִ⁠בֵּ֣ית לֶ֔חֶם	1	Here the writer uses the present tense in past narration in order to call attention to an important event in the story. If it would not be natural to do that in your language, you could use the past tense and call attention to the event in another way. Alternate translation: “appeared, coming from Bethlehem”
2:4	q3zk		rc://*/ta/man/translate/translate-blessing	יְהוָ֣ה עִמָּ⁠כֶ֑ם	1	This is a blessing used as a greeting. Use a form for this that would be natural in your language. Alternate translation: “I ask Yahweh to be with you”
2:4	r4bl		rc://*/ta/man/translate/translate-blessing	יְבָרֶכְ⁠ךָ֥ יְהוָֽה	1	This is a blessing used as a greeting. Use a form for this that would be natural in your language. Alternate translation: “I ask Yahweh to do good things for you”
2:5	sdf9		rc://*/ta/man/translate/figs-idiom	הַ⁠נִּצָּ֖ב עַל	1	Here, **set over** is an idiom that means “managing.” If this phrase does not have that meaning in your language, you could use an idiom from your language that does have this meaning or state the meaning plainly. Alternate translation: “who was overseeing” or “who was in charge of”
2:5	a5ht		rc://*/ta/man/translate/translate-kinship	לְ⁠מִ֖י הַ⁠נַּעֲרָ֥ה הַ⁠זֹּֽאת	1	In that culture, women were under the authority of their male relatives. Boaz was asking whom Ruth’s husband or father might be. He did not think that Ruth was a slave.
2:6	ty7q		rc://*/ta/man/translate/figs-hendiadys	וַ⁠יַּ֗עַן & וַ⁠יֹּאמַ֑ר	1	The two words **answered** and **said** express a single idea. If it would be more natural in your language, you could express this idea in a different way. Alternate translation: “Then … answered him by saying” or “Then … said”
2:7	lqec		rc://*/ta/man/translate/figs-quotesinquotes	וַ⁠תֹּ֗אמֶר אֲלַקֳטָה־נָּא֙ וְ⁠אָסַפְתִּ֣י בָֽ⁠עֳמָרִ֔ים אַחֲרֵ֖י הַ⁠קּוֹצְרִ֑ים	1	If your language would not use a direct quotation inside of a direct quotation, you could translate this second direct quotation as an indirect quotation. Alternate translation: “She asked me if she could glean and gather among the bundles of grain after the reapers”
2:7	n696		rc://*/ta/man/translate/figs-hendiadys	אֲלַקֳטָה־נָּא֙ וְ⁠אָסַפְתִּ֣י	1	The two words **glean** and **gather** express a single idea. If it would be more natural in your language, you could express this idea in a different way. Alternate translation: “Please let me glean by gathering”
2:7	kj7a		translate-unknown	הַ⁠בַּ֖יִת	1	Here, **the house** was a temporary shelter or garden hut in the field that provided shade from the sun where the workers could rest. Alternate translation: “in the hut” or “in the shed”
2:8	ltk3		rc://*/ta/man/translate/figs-rquestion	הֲ⁠ל֧וֹא שָׁמַ֣עַתְּ בִּתִּ֗⁠י	1	Boaz is using the question form to draw Ruth's attention to what he will say to her. If you would not use the question form for this purpose in your language, you could translate this as a statement or an exclamation. Alternate translation: “Listen to me, my daughter!” or “Note well what I am telling you, my daughter!”
2:8	ke9b		rc://*/ta/man/translate/figs-idiom	בִּתִּ֗⁠י	1	Boaz's use of the term, **my daughter** was a kind way to address a younger woman. Ruth was not the actual daughter of Boaz, but he was treating her kindly and respectfully. Use the term that communicates kindness and respect from a man to a younger woman in your language.
2:9	jq6n		rc://*/ta/man/translate/figs-metonymy	עֵינַ֜יִ⁠ךְ בַּ⁠שָּׂדֶ֤ה	1	Here, the word **eyes** represents the capability of a person to see, watch or observe. If it would be helpful to your readers, you could use an equivalent expression from your language or state the meaning plainly. Alternate translation: “Watch only the field” or “Pay attention only to the field”
2:9	ldfq		rc://*/ta/man/translate/figs-pronouns	אַחֲרֵי⁠הֶ֔ן	1	Here, **them** is feminine and refers back to the “young female workers” in verse 8. If it would be helpful in your language, you could use a word or phrase that makes that clear. Alternate translation: “behind the women”
2:9	xc6u		rc://*/ta/man/translate/figs-rquestion	הֲ⁠ל֥וֹא צִוִּ֛יתִי אֶת־הַ⁠נְּעָרִ֖ים לְ⁠בִלְתִּ֣י נָגְעֵ֑⁠ךְ	1	Boaz is using the question form to emphasize his hospitality—that he had already made provision to help Ruth. If you would not use the question form for this purpose in your language, you could translate this as a statement or an exclamation. Alternate translation: “I have given the men strict instructions not to interfere with you.”
2:9	ub62		rc://*/ta/man/translate/figs-explicit	אֶת־הַ⁠נְּעָרִ֖ים	1	The writer assumes that his readers will understand the implications of a woman toiling in a field near young male workers. You can include this information if that would be helpful to your readers. Alternate translation: “the workmen”
2:9	v5e4		rc://*/ta/man/translate/figs-euphemism	לְ⁠בִלְתִּ֣י נָגְעֵ֑⁠ךְ	1	The writer is referring to harm or sexual assault in a polite way by using the phrase **touch you**. If it would be helpful to your readers, you could use a polite way of referring to this in your language, or you could state this plainly. Alternate translation: “not to assault you sexually”
2:9	ahr7			מֵ⁠אֲשֶׁ֥ר יִשְׁאֲב֖וּ⁠ן הַ⁠נְּעָרִֽים	1	Alternate translation: “from water pulled up from the well by the workmen”
2:10	ab12		rc://*/ta/man/translate/figs-doublet	וַ⁠תִּפֹּל֙ עַל־פָּנֶ֔י⁠הָ וַ⁠תִּשְׁתַּ֖חוּ אָ֑רְצָ⁠ה	1	These are two descriptions of a single action. The writer may be using the two terms together for emphasis. If it would be clearer for your readers, you could express the emphasis with a single phrase. Alternative translation: “Then she prostrated herself before him”
2:10	az6y		rc://*/ta/man/translate/translate-symaction	וַ⁠תִּפֹּל֙ עַל־פָּנֶ֔י⁠הָ וַ⁠תִּשְׁתַּ֖חוּ אָ֑רְצָ⁠ה	1	The action of falling **on her face** and bowing **down to the ground** was a symbol of respect and reverence. She was showing honor to Boaz out of gratefulness for what he had done for her. It was also a posture of humility. If this would not be clear to your readers, you could explain the significance of this action. Alternate translation: “Then she prostrated herself before him to show gratitude and honor”
2:10	ab13		rc://*/ta/man/translate/figs-idiom	וַ⁠תִּפֹּל֙ עַל־פָּנֶ֔י⁠הָ וַ⁠תִּשְׁתַּ֖חוּ אָ֑רְצָ⁠ה	1	The idiom **fell on her face** means that she bowed low with her face to the ground. If your readers would misunderstand this, you could state the meaning plainly. Alternate translation: “Then she bowed low, with her face to the ground”
2:10	ug7p		rc://*/ta/man/translate/grammar-connect-logic-contrast	מַדּוּעַ֩ מָצָ֨אתִי חֵ֤ן בְּ⁠עֵינֶ֨י⁠ךָ֙ לְ⁠הַכִּירֵ֔⁠נִי וְ⁠אָּנֹכִ֖י נָכְרִיָּֽה	1	Ruth's question expresses surprise and also explicitly states the reason why she is surprised by Boaz’s kindness. It is a contrast from her expectations. Use a natural way in your language for introducing a contrast. In some languages you may need to make part of her question a statement. Alternate translation: “Why have I found favor in your eyes? Israelites never show Moabites this sort of kindness.” or “People never show foreigners this sort of kindness.”
2:10	abc7		rc://*/ta/man/translate/figs-idiom	מָצָ֨אתִי חֵ֤ן בְּ⁠עֵינֶ֨י⁠ךָ֙	1	The phrase **found favor in your eyes** is an idiom that means that you have approved of someone. Ruth speaks of gaining someone’s favor as gaining their kindness or approval. If it would be helpful to your readers, you could state the meaning plainly. Alternate translation: “have you shown kindness to me”
2:11	ab14		rc://*/ta/man/translate/figs-hendiadys	וַ⁠יַּ֤עַן בֹּ֨עַז֙ וַ⁠יֹּ֣אמֶר	1	Both **answered** and **said** describe the same action. If it would be helpful in your language, you could use only one verb for this, as in the UST. Alternate translation: “Then Boaz responded”
2:11	nnmx		rc://*/ta/man/translate/figs-reduplication	הֻגֵּ֨ד הֻגַּ֜ד	1	The words **It has been fully reported** translate a verb that is repeated twice to emphasize the fullness of the report. If your language can repeat words for emphasis, it would be appropriate to use that construction here in your translation.
2:11	app6		rc://*/ta/man/translate/figs-activepassive	הֻגֵּ֨ד הֻגַּ֜ד לִ֗⁠י	1	If your language does not use the passive form in this way, you can state this in active form or in another way that is natural in your language. Alternate translation: “People have fully reported to me”
2:11	r44n		rc://*/ta/man/translate/figs-metonymy	וַ⁠תֵּ֣לְכִ֔י אֶל־עַ֕ם	1	With the words **you came to a people**, Boaz is referring to Ruth coming to dwell with Naomi in a village and community, a country and religion that she did not know.
2:11	ab60		rc://*/ta/man/translate/figs-idiom	תְּמ֥וֹל שִׁלְשֽׁוֹם׃	1	Here, **the day before yesterday** is an idiom that means “recently.” If this phrase does not have that meaning in your language, you could use an idiom from your language that does have this meaning or state the meaning plainly. Alternate translation: “before” or “a little while ago”
2:12	s2vm		rc://*/ta/man/translate/figs-explicit	פָּעֳלֵ֑⁠ךְ	1	The implication is that her **work** was the good things she had done, everything Boaz had just described. You could include this information if that would be helpful to your readers. Alternate translation: “your good deeds.”
2:12	gnn5		rc://*/ta/man/translate/figs-parallelism	וּ⁠תְהִ֨י מַשְׂכֻּרְתֵּ֜⁠ךְ שְׁלֵמָ֗ה מֵ⁠עִ֤ם יְהוָה֙	1	This clause and the previous clause mean basically the same thing. The second clause emphasizes the meaning of the first by repeating the same idea with different words. If it would be helpful to your readers, you could connect the clauses in a way that shows that the second clause is repeating the first one, not saying something additional. Alternate translation: “that is, may you receive everything that you deserve from Yahweh”
2:12	eh86		rc://*/ta/man/translate/figs-metaphor	אֲשֶׁר־בָּ֖את לַ⁠חֲס֥וֹת תַּֽחַת־כְּנָפָֽי⁠ו	1	Here, **under whose wings** is a metaphor that uses the picture of a mother bird gathering her chicks under her wings to protect them as a way to describe God’s protection for those who trust in him. Alternate translation: “in whose safe care you have placed yourself”
2:13	abc6		rc://*/ta/man/translate/figs-idiom	אֶמְצָא־חֵ֨ן בְּ⁠עֵינֶ֤י⁠ךָ	1	Here **find favor in your eyes** is an idiom that means to be approved of or to be found to be pleasing. Alternate translation: “May you continue to approve of me” or “May you continue to be pleased with me”
2:13	abc4		rc://*/ta/man/translate/writing-politeness	אֲדֹנִ⁠י֙	1	Ruth speaks to Boaz using a respectful title, **my lord**. Use a form for addressing someone respectfully in your language. Boaz is not Ruth’s master, but he is the owner of the field where she is gleaning. He is also a Jew and a prominent man in the city. Therefore, Ruth is honoring him by calling him her **lord**, and speaking of herself as his servant. Alternate translation: “sir” or “master”
2:13	px4k		rc://*/ta/man/translate/figs-123person	עַל־לֵ֣ב שִׁפְחָתֶ֑⁠ךָ	1	Ruth is speaking about herself in the third person. If this would not be natural in your language, you could use the first person form. Alternate translation: “to the heart of me, your female servant”
2:13	d2hx		rc://*/ta/man/translate/figs-metaphor	עַל־לֵ֣ב	1	Here, **the heart** represents the inner thoughts and emotions of a person. If it would be helpful in your language, you could use a different metaphor or state the meaning plainly. Alternate translation: “to the liver of” or “with kindness to” or “in an encouraging way to”
2:13	nyr3		rc://*/ta/man/translate/writing-politeness	שִׁפְחָתֶ֑⁠ךָ	1	Ruth is referring to herself as Boaz's servant to show respect to him. She is not actually one of his servants. If it would be helpful in your language, you could make that clear. Alternate translation: “one who is as lowly as a servant”
