Reference	ID	Tags	SupportReference	Quote	Occurrence	Note
front:intro	f68r				0	# Introduction to Ruth\n\n## Part 1: General Introduction\n\n### Outline of Ruth\n\n1. Naomi goes to Moab with her family (1:1–5)\n1. Ruth comes to Bethlehem with Naomi (1:6–22)\n1. Boaz helps Ruth as she gleans (2:1–23)\n1. Boaz and Ruth at the threshing floor (3:1–18)\n1. Ruth becomes the wife of Boaz (4:1–16)\n1. Obed born to Ruth and Boaz; the genealogy of David (4:13–22)\n\n### What is the book of Ruth about?\n\nThis book is about a non-Israelite woman named Ruth. It tells how she came to join the people of Yahweh. The book also explains how Ruth became an ancestor of King David.\n\n### How should the title of this book be translated?\n\nThis book traditionally has the title **Ruth** because she is the main person in it. If the church prefers, you could use a fuller title such as **The Book About Ruth**. (See: [[rc://*/ta/man/translate/translate-names]])\n\n### When did the events in the book of Ruth occur?\n\nThe story of Ruth is set during the time when there were judges in Israel. This was after the people of Israel had entered into the land of Canaan, but before they had a king. The judges were men and women whom God chose to help the Israelites defeat their enemies. These leaders usually continued to help the people by deciding disputes among them. They also helped the people make important decisions. Many of these leaders served all the people of Israel, but some of them may have served only certain tribes.\n\n## Part 2: Important Religious and Cultural Concepts\n\n### Why does Scripture include a book about a woman from the foreign land of Moab?\n\nIn a period when Israel was often unfaithful to Yahweh, a woman from Moab showed great faith in him. The Israelites’ frequent lack of faith in Yahweh is contrasted with the faith of this woman from a foreign land. This shows us that God is the God of all people, not just of Israel. (See: [[rc://*/tw/dict/bible/kt/faithful]])\n\n### What important marriage custom is found in the book of Ruth?\n\nIsraelites practiced what is called “levirate marriage.” In this custom, the closest male relative of a man who died without any children was obligated to provide for his widow by marrying her. Usually this would be one of the man’s brothers. Any children born to them were to be regarded as children of the dead man. They did this so that the dead man would have descendants. If the closest relative did not marry the woman, another relative could fulfill this obligation.\n\n### What was a “kinsman-redeemer”?\n\nA person’s close relative or relatives were expected to act as “kinsmen-redeemers” (2:20 ULT) for him or her. They were responsible to provide for a relative in need, fulfill obligations of levirate marriage, and buy back land into the family that had been sold to someone outside of the family. In the book of Ruth, Boaz is one such kinsman-redeemer.\n\n### What was “gleaning” in the book of Ruth?\n\nIn Israel, poor people were allowed to follow after the men who harvested a field. These gleaners picked up stalks of grain that the harvesters missed or dropped. In this way, poor people were able to find some food. Ruth became a gleaner in a field belonging to Boaz.\n\n### What is covenant faithfulness or covenant loyalty?\n\nA covenant is a formal, binding agreement between two parties that one or both parties must fulfill. Covenant faithfulness or covenant loyalty is when a person does what they said they would do according to the covenant that they had made. God made a covenant with Israel in which he promised that he would love and be faithful to the Israelites. The Israelites were to do the same toward him and toward each other.\n\nThe book of Ruth shows that what kinsmen-redeemers do for their relatives is part of Israel’s duties according to God’s covenant with them. The story of Boaz, Ruth, and Naomi gives examples to all of Israel of the good effects of covenant faithfulness. (See: [[rc://*/tw/dict/bible/kt/covenantfaith]])\n\n### What function did city gates have in the ancient Near East?\n\nCity gates in the time of Boaz were meeting places for the city elders. Elders were honored men who decided business matters and legal matters together. The city walls were thick, especially at the entryways, and the gates had guard towers beside and above them. Therefore, the gateway opening provided a large shady area for public meetings and there were places for important people to sit. For this reason, Boaz and the other elders sat in the gateway.\n\nSome English Bible versions speak of Boaz sitting at the city gate, but it may be best for translators to make clear that Boaz sat in the city gateway.\n\n## Part 3: Important Translation Issues\n\n### How does the book of Ruth change from one topic to another topic?\n\nThe book of Ruth often changes to new topics or new parts of the story. The ULT uses various words to indicate these changes, such as “so,” “then,” and “now.” Translators should use the ways most natural in their own languages to signal these changes.
1:intro	irf4				0	# Ruth 1 General Notes\n\n## Structure and Formatting\n\n### **It happened in the days when the judges ruled**\n\nThe events of this book occur during the period of Judges. The book is concurrent with the book of Judges. To understand the historical context of the book, the translator may wish to review the book of Judges.\n\n## Religious and Cultural Concepts in This Chapter\n\n### Women without a husband or children\n\nIn the ancient Near East, if a woman lacked a husband or sons, she was considered to be in a dire circumstance. She would not have been able to provide for herself. This is why Naomi told her daughters to remarry.\n\n## Translation Issues in This Chapter\n\n### Contrast\n\nThe actions of Ruth the Moabite are intended to contrast with the actions of Naomi the Jew. Ruth shows great faith in Naomi’s God, while Naomi does not trust in Yahweh. (See: [[rc://*/tw/dict/bible/kt/faith]] and [[rc://*/tw/dict/bible/kt/trust]])
1:1	sb2j		rc://*/ta/man/translate/writing-newevent	וַ⁠יְהִ֗י	1	This phrase translates a common way of beginning a historical story in the Bible. Use a natural way of beginning a true story that happened a long time ago. Alternative translation: “It was”
1:1	m9nl		rc://*/ta/man/translate/grammar-connect-time-simultaneous	בִּ⁠ימֵי֙ שְׁפֹ֣ט הַ⁠שֹּׁפְטִ֔ים	1	The phrase **in the days of** indicates the time period during which the famine happened. The famine probably lasted for years, not just days. Use a natural form in your language for introducing the time during which another event happened. Alternate translation: “in the time when the judges ruled”
1:1	nm13		rc://*/ta/man/translate/figs-explicit	בָּ⁠אָ֑רֶץ	1	This phrase, **in the land**, refers to the land of Israel. You could include this information if that would be helpful to your readers. Alternate translation: “in the land of Israel”
1:1	mmb4		rc://*/ta/man/translate/writing-participants	אִ֜ישׁ	1	This is a common way of introducing a character into a story. Use a natural way in your language for introducing a new participant in a story.
1:2	e53a		rc://*/ta/man/translate/translate-names	אֶפְרָתִ֔ים	1	The term **Ephrathites** refers to the people from the clan of Ephrathah, people who lived in the area around Bethlehem. Alternate translation: “from the clan of Ephrathah”
1:3	rxb1		rc://*/ta/man/translate/figs-activepassive	וַ⁠תִּשָּׁאֵ֥ר הִ֖יא וּ⁠שְׁנֵ֥י בָנֶֽי⁠הָ׃	1	If your language does not use this passive form, you could express the idea in active form or in another way that is natural in your language. Alternate translation: “Naomi and her two sons remained in Moab without him”
1:4	pk7g		rc://*/ta/man/translate/figs-idiom	וַ⁠יִּשְׂא֣וּ לָ⁠הֶ֗ם נָשִׁים֙	1	The phrase **took wives for themselves** is an idiom that means that they married women. They did not take women by force or take women who were already married to other men.
1:4	aee6			שֵׁ֤ם הָֽ⁠אַחַת֙ עָרְפָּ֔ה וְ⁠שֵׁ֥ם הַ⁠שֵּׁנִ֖ית ר֑וּת	1	If your language must distinguish which woman married which son, you can say that Orpah married Kilion and that Ruth married Mahlon. Alternate translation: “the name of the woman who married Kilion was Orpah, and the name of the woman who married Mahlon was Ruth”
1:5	dbr3		rc://*/ta/man/translate/figs-activepassive	וַ⁠תִּשָּׁאֵר֙ הָֽ⁠אִשָּׁ֔ה מִ⁠שְּׁנֵ֥י יְלָדֶ֖י⁠הָ וּ⁠מֵ⁠אִישָֽׁ⁠הּ	1	If your language does not use this passive form, you could express the idea in active form or in another way that is natural in your language. Alternate translation: “and the woman was alone without her husband or her two sons” or “and Naomi remained widowed and childless”
1:6	wsr0		rc://*/ta/man/translate/writing-newevent	וַ⁠תָּ֤קָם הִיא֙ וְ⁠כַלֹּתֶ֔י⁠הָ וַ⁠תָּ֖שָׁב	1	This part of the sentence forms an introductory summary of what will happen in the following section. It does not relate events in the timeline of the story. If your language does not use introductory summaries like this, you can translate these actions as events. Alternate translation: “Then she, along with her daughters-in-law, prepared to return”
1:6	tmq3		rc://*/ta/man/translate/writing-participants	וַ⁠תָּ֤קָם הִיא֙ וְ⁠כַלֹּתֶ֔י⁠הָ וַ⁠תָּ֖שָׁב	1	The verbs **arose** and **returned** are singular, and refer to Naomi. This shows that Naomi is the main character who takes the initiative in these actions. However, her daughters-in-law are included. If your language requires plural verbs when more than one person is included in an action, you can use them here. Alternate translation: “Then she and her daughters-in-law arose and returned”
1:6	u9q2			וְ⁠כַלֹּתֶ֔י⁠הָ	1	Alternate translation: “and the women who had married her sons”
1:6	zo55		rc://*/ta/man/translate/figs-infostructure	כִּ֤י שָֽׁמְעָה֙ בִּ⁠שְׂדֵ֣ה מוֹאָ֔ב כִּֽי־פָקַ֤ד יְהוָה֙ אֶת־עַמּ֔⁠וֹ\nלָ⁠תֵ֥ת לָ⁠הֶ֖ם לָֽחֶם	1	Naomi first heard about Yahweh visiting his people and then decided to return to Bethlehem, so it might be more natural to put this information first, as in the UST.
1:6	sa4z		rc://*/ta/man/translate/figs-explicit	שָֽׁמְעָה֙ בִּ⁠שְׂדֵ֣ה מוֹאָ֔ב	1	It is implied that the news came from Israel. Alternate translation: “while she was in the region of Moab, she had heard from someone who came from Israel”
1:6	v86z		rc://*/ta/man/translate/figs-idiom	פָקַ֤ד & אֶת־עַמּ֔⁠וֹ	1	Here, **visited** is an idiom that means “taken care of.” If this phrase does not have that meaning in your language, you could use an idiom from your language that does have this meaning or state the meaning plainly. Alternate translation: “had relieved the hunger of his people” or “had come through for his people”
1:6	ab01		rc://*/ta/man/translate/figs-synecdoche	לָ⁠תֵ֥ת לָ⁠הֶ֖ם לָֽחֶם׃	1	Here, **bread** refers to food in general. Alternate translation: “giving them abundant harvests, so that they had plenty of food.”
1:7	w7ti			וַ⁠תֵּלַ֣כְנָה בַ⁠דֶּ֔רֶךְ	1	Alternate translation: “And they walked along the road”
1:8	fu39			לִ⁠שְׁתֵּ֣י כַלֹּתֶ֔י⁠הָ	1	Alternate translation: “to her two sons’ wives” or “to the widows of her two sons”
1:8	lxs2		rc://*/ta/man/translate/figs-youdual	 לֵ֣כְנָה שֹּׁ֔בְנָה אִשָּׁ֖ה	1	Since Naomi is speaking to two people, the form of address would be dual here, if your language uses that form.
1:8	hizu			 לֵ֣כְנָה שֹּׁ֔בְנָה אִשָּׁ֖ה לְ⁠בֵ֣ית אִמָּ֑⁠הּ	1	If this custom seems strange to your readers, you could include a footnote to explain it, such as: “According to the custom of the ancient Hebrews, a young widow could either stay with the family of her deceased husband or return to live with her parents until she married again.”
1:8	hsf7			לְ⁠בֵ֣ית אִמָּ֑⁠הּ	1	Alternate translation: “to the home of your mother”
1:8	nnen		rc://*/ta/man/translate/translate-blessing	יעשה יְהוָ֤ה עִמָּ⁠כֶם֙ חֶ֔סֶד כַּ⁠אֲשֶׁ֧ר עֲשִׂיתֶ֛ם עִם־הַ⁠מֵּתִ֖ים וְ⁠עִמָּדִֽ⁠י	1	Naomi is asking God to bless Orpah and Ruth. Use a natural form for a blessing in your language. Alternate translation: “I pray that Yahweh will show you covenant faithfulness such as you have shown to the dead and to me.”
1:8	acb4		rc://*/ta/man/translate/figs-nominaladj	עִם־הַ⁠מֵּתִ֖ים	1	The writer is using the adjective **dead** as a noun to mean those who have died. Your language may use adjectives in the same way. If not, you could translate this word with an equivalent phrase. Alternate translation: “toward your husbands, who died,”
1:8	etw2		rc://*/ta/man/translate/figs-abstractnouns	חֶ֔סֶד	1	If your language does not use an abstract noun for the idea of **faithfulness**, you could express the same idea in another way. Alternate translation: “loyally and faithfully”
1:9	pm6y		rc://*/ta/man/translate/translate-blessing	יִתֵּ֤ן יְהוָה֙ לָ⁠כֶ֔ם וּ⁠מְצֶ֣אןָ	1	Here, Naomi continues her blessing. Use a natural form for a blessing in your language. Alternate translation: “May Yahweh give you” or “I pray that Yahweh will allow you to have”
1:9	c74v		rc://*/ta/man/translate/figs-metaphor	וּ⁠מְצֶ֣אןָ מְנוּחָ֔ה	1	The word **rest** here does not refer to sitting down to rest. It means a place where these women would belong, a home for them, which would include the security that comes through marriage. Alternate translation: “a safe and stable home”
1:9	v2vx		rc://*/ta/man/translate/figs-metonymy	בֵּ֣ית אִישָׁ֑⁠הּ	1	This means with new husbands, not with their previous husbands, who died, or with someone else’s husband. The word **house** refers to both a physical house that belongs to the husband and to the protection from shame and poverty that a husband provides. Alternate translation: “in her own husband's household”
1:9	t69w		rc://*/ta/man/translate/figs-idiom	וַ⁠תִּשֶּׂ֥אנָה קוֹלָ֖⁠ן וַ⁠תִּבְכֶּֽינָה	1	To lift up the voice is an idiom for speaking or crying loudly. Alternate translation: “and they cried loudly” or “and they wept bitterly”
1:10	mag8		rc://*/ta/man/translate/figs-exclusive	נָשׁ֖וּב	1	When Orpah and Ruth said **we,** they were referring to themselves and not Naomi. So languages that have inclusive and exclusive forms of **we** would use the exclusive form here.
1:10	hilu		rc://*/ta/man/translate/grammar-connect-logic-contrast	וַ⁠תֹּאמַ֖רְנָה	1	The word **But** here indicates a strong contrast between what Naomi said and what the daughters-in-law are about to say. In your translation, indicate this strong contrast in a way that is natural in your language. Alternate translation: “Nevertheless, they said”
1:10	u1dh		rc://*/ta/man/translate/grammar-connect-logic-contrast	כִּי־	1	The daughters-in-law use the word **Rather** here to indicate a strong contrast between what Naomi wants them to do and what they propose to do. In your translation, indicate this strong contrast in a way that is natural in your language. Alternate translation: “Instead of that”
1:10	bq4j		rc://*/ta/man/translate/figs-yousingular	אִתָּ֥⁠ךְ	1	The word **you** is singular here because it refers to Naomi.
1:11	q849		rc://*/ta/man/translate/grammar-connect-logic-contrast	וַ⁠תֹּ֤אמֶר נָעֳמִי֙ 	1	The word **But** here indicates a strong contrast between what the daughters-in-law said and what Naomi is about to say. In your translation, indicate this strong contrast in a way that is natural in your language. Alternate translation: “However, Naomi said”
1:11	b8q1			בְנֹתַ֔⁠י	1	Orpah and Ruth are Naomi's daughters-in-law, but here and in the next two verses she calls them **my daughters** as a term of affection. If your language would not do that, you can express the affection in another way. Alternate translation: “my beloved daughters-in-law”
1:11	ggi3		rc://*/ta/man/translate/figs-rquestion	לָ֥⁠מָּה תֵלַ֖כְנָה עִמִּ֑⁠י	1	Naomi is using the question form here to convince the young women of her own conviction. If you would not use the question form for this purpose in your language, you could translate this as a statement or an exclamation. Alternate translation: “It does not make sense for you to go with me.” or “You should not go with me!”
1:11	q2hn		rc://*/ta/man/translate/figs-rquestion	הַֽ⁠עֽוֹד־לִ֤⁠י בָנִים֙ בְּֽ⁠מֵעַ֔⁠י וְ⁠הָי֥וּ לָ⁠כֶ֖ם לַ⁠אֲנָשִֽׁים	1	Naomi is using the question form to make the point that she cannot have other sons for the young women to marry. If you would not use the question form for this purpose in your language, you could translate this as a statement or an exclamation. Alternate translation: “You know that I cannot have any more sons who could become your husbands.”
1:12	dyc4		rc://*/ta/man/translate/figs-explicit	זָקַ֖נְתִּי מִ⁠הְי֣וֹת לְ⁠אִ֑ישׁ	1	The implication is that Naomi cannot again marry and provide them with husbands. You could include this information if that would be helpful to your readers. Alternate translation: “I am too old to marry again and bear more children”
1:12	abc1		rc://*/ta/man/translate/figs-rquestion	כִּ֤י אָמַ֨רְתִּי֙ יֶשׁ־לִ֣⁠י תִקְוָ֔ה גַּ֣ם הָיִ֤יתִי הַ⁠לַּ֨יְלָה֙ לְ⁠אִ֔ישׁ וְ⁠גַ֖ם יָלַ֥דְתִּי בָנִֽים	1	This rhetorical question begins here and continues into the next verse. Naomi uses this question to emphasize that she cannot provide other sons for them to marry. If you would not use the question form for this purpose in your language, you could translate this as a statement or an exclamation. Alternate translation: “Even if it were possible that I could expect to marry right away and also give birth to sons right away”
1:12	kh9g			יָלַ֥דְתִּי בָנִֽים	1	Alternate translation: “I were to bear sons” or “I were to deliver baby boys”
1:13	gmc2		rc://*/ta/man/translate/figs-rquestion	הֲ⁠לָהֵ֣ן ׀ תְּשַׂבֵּ֗רְנָה עַ֚ד אֲשֶׁ֣ר יִגְדָּ֔לוּ הֲ⁠לָהֵן֙ תֵּֽעָגֵ֔נָה לְ⁠בִלְתִּ֖י הֱי֣וֹת לְ⁠אִ֑ישׁ	1	Naomi completes the rhetorical question she began in the previous verse and immediately asks another rhetorical question which emphasizes the same meaning. Alternate translation: “you would not wait until they were grown up so that you could marry them. You would need to marry a husband before then.”
1:13	ab04			הֲ⁠לָהֵ֣ן ׀ תְּשַׂבֵּ֗רְנָה עַ֚ד אֲשֶׁ֣ר יִגְדָּ֔לוּ הֲ⁠לָהֵן֙ תֵּֽעָגֵ֔נָה לְ⁠בִלְתִּ֖י הֱי֣וֹת לְ⁠אִ֑ישׁ	1	This idea refers to the custom among the ancient Hebrews that, if a married man died, one of his brothers would marry the man’s widow. See the introduction for more explanation. If it would be helpful, you could put some of this information in a footnote.
1:13	gh99		rc://*/ta/man/translate/figs-metaphor	מַר־לִ֤⁠י מְאֹד֙	1	Here, bitterness is a metaphor for grief. Alternate translation: “it is a great grief for me”
1:13	z9u3		rc://*/ta/man/translate/figs-metonymy	יָצְאָ֥ה בִ֖⁠י יַד־יְהוָֽה	1	Here, **hand** represents the power of God. If it would be helpful in your language, you could use an equivalent expression from your language or state the meaning plainly. Alternate translation: “the power of Yahweh has caused terrible things to happen to me”
1:13	ab02		rc://*/ta/man/translate/figs-explicit	יָצְאָ֥ה בִ֖⁠י יַד־יְהוָֽה	1	The implication is that Yahweh caused the deaths of Naomi's family. You could include this information if that would be helpful to your readers. Alternate translation: “Yahweh has taken away our husbands”
1:14	n47v		rc://*/ta/man/translate/figs-idiom	וַ⁠תִּשֶּׂ֣נָה קוֹלָ֔⁠ן וַ⁠תִּבְכֶּ֖ינָה	1	Here, **they lifted up their voices** is an idiom meaning that they expressed themselves loudly. If this phrase does not have that meaning in your language, use an idiom from your language that does have that meaning or state the meaning plainly. Alternate translation: “Then they wailed and wept loudly”
1:14	t4sl		rc://*/ta/man/translate/figs-metaphor	וְ⁠ר֖וּת דָּ֥בְקָה בָּֽ⁠הּ	1	This could mean: (1) Ruth refused to leave Naomi. Alternate translation: “but Ruth would not leave her” or (2) Ruth physically held on to Naomi and would not let go of her. Alternate translation: “but Ruth held on to her”
1:15	ld6g		rc://*/ta/man/translate/figs-metaphor	הִנֵּה֙	1	Naomi is using the term **Behold** to focus Ruth's attention on what she is about to say. Your language may have a comparable expression that you could use in your translation. Alternate translation: “Listen” or You know”
1:15	nqm3		rc://*/ta/man/translate/writing-participants	יְבִמְתֵּ֔⁠ךְ	1	Naomi is using the phrase **your sister-in-law** to refer to Orpah, the widow of Ruth's deceased husband's brother. Use the natural term in your language to refer to that relationship. Alternate translation: “the widow of your husband’s brother” or “Orpah”
1:15	i9wa		rc://*/ta/man/translate/figs-possession	עַמָּ֖⁠הּ	1	Here, Naomi is using the possessive form to describe the **people** to whom Orpah belongs. If your language would not use the possessive form for this, you could express this in another way. Alternate translation: “the clan that she came from”
1:15	man4		rc://*/ta/man/translate/figs-possession	אֱלֹהֶ֑י⁠הָ	1	Here, Naomi is using the possessive form to describe the **god** of the Moabites that Orpah and Ruth used to worship before they married Naomi's sons and began to worship Yahweh. If your language would not use the possessive form to express the relationship between Orpah and this god, you could express this in another way. Alternate translation: “the god that they worship”
1:15	m9o6		rc://*/ta/man/translate/translate-plural	אֱלֹהֶ֑י⁠הָ	1	The word translated here as **god** is plural, but Hebrew quite commonly uses the plural when referring to a deity. Here it probably refers to the god of the Moabites named Chemosh, as it does in 1 Kings 11:33. If the Bible commonly used in your area uses a plural here, you may choose to do so too. Alternate translation: “her gods”
1:16	z5ug			וּ⁠בַ⁠אֲשֶׁ֤ר תָּלִ֨ינִי֙	1	Alternate translation: “and where you live”
1:16	wspu		rc://*/ta/man/translate/figs-doublet	לְ⁠עָזְבֵ֖⁠ךְ לָ⁠שׁ֣וּב מֵ⁠אַחֲרָ֑יִ⁠ךְ	1	The phrase **turn back from behind you** further defines the phrase **forsake you**. Ruth is using the two phrases together for emphasis. If it would be clearer for your readers, you could use a single phrase and express the emphasis in another way. Alternate translation: “to forget my commitment to remain loyal to you”
1:16	b518		rc://*/ta/man/translate/figs-ellipsis	עַמֵּ֣⁠ךְ עַמִּ֔⁠י וֵ⁠אלֹהַ֖יִ⁠ךְ אֱלֹהָֽ⁠י	1	With these phrases, Ruth completely identifies herself with the culture and religion of Naomi, an Israelite. The original does not have any verbs, so if your language requires verbs here, choose the ones that best communicate this. Alternate translation: “Your people will be my people, and your God will be my God”
1:17	sje3		rc://*/ta/man/translate/writing-oathformula	כֹּה֩ יַעֲשֶׂ֨ה יְהוָ֥ה לִ⁠י֙ וְ⁠כֹ֣ה יֹסִ֔יף	1	Ruth uses this oath formula to show that she is very committed to doing what she says. She calls down a curse on herself, asking God to punish her if she does not do what she has said she would do. In keeping with the custom, she did not express what that punishment would be. Use a natural way in your language to express an oath. Alternate translation: “May Yahweh strike me dead, and may he do more, and may he do even more”
1:17	abc2		rc://*/ta/man/translate/figs-hyperbole	כִּ֣י הַ⁠מָּ֔וֶת יַפְרִ֖יד בֵּינִ֥⁠י וּ⁠בֵינֵֽ⁠ךְ	1	This could mean: (1) even death cannot overcome Ruth's commitment to Naomi. This could be a form of hyperbole or simply a way to restate her commitment to be buried in the same place as Naomi is buried. Alternate translation: “if even death separates us from each other” (2) the only thing that can separate Ruth from Naomi would be the death of one of them. Alternate translation: “if anything other than death separates us from each other” or “if I leave you while you and I are both still alive”
